{
  "lead_id": "REF-097",
  "title_exact": "壁上万象",
  "locale": "zh-CN",
  "type_mode": "CUSTOM_DISPLAY",
  "skeleton_class": "custom-display with serif-like contrast",
  "reference_font_is_custom": true,
  "stroke_contrast": "high/varied",
  "apparent_weight": "mixed",
  "apparent_width": "varied",
  "arrangement": "right-side vertical group",
  "reference_crop": "case_studies/V13_DUNHUANG_CJK_FAILURE/lead_REF-097.jpg",
  "candidate_fonts": [],
  "glyph_observations": [
    {
      "glyph": "壁",
      "review": "not yet validated"
    },
    {
      "glyph": "上",
      "review": "not yet validated"
    },
    {
      "glyph": "万",
      "review": "not yet validated"
    },
    {
      "glyph": "象",
      "review": "not yet validated"
    }
  ],
  "type_visual_result": "RED",
  "browser_evidence": {
    "status": "UNAVAILABLE_FOR_ORIGINAL_GENERATION"
  },
  "risks": [
    "Custom glyph shapes cannot be replicated by font family name alone",
    "Do not infer CSS fallback from screenshot"
  ]
}
